{
  "billing_source": null,
  "candidate_hosted_seconds": 319,
  "captured_at": "2026-08-24T00:00:00Z",
  "ccp": null,
  "classification": "observed_baseline",
  "comparability": "pass",
  "eligibility_reason": "Historical pre-activation elapsed-time baseline.",
  "estimated_avoided_hosted_seconds": 319,
  "estimated_net_hosted_seconds_saved": 269,
  "fallback_reason": null,
  "limitations": [
    "Baseline observations do not count as activated savings."
  ],
  "negative_case": null,
  "observed_verifier_seconds": 50,
  "pr_number": null,
  "provider_confirmed_billed_minutes": null,
  "provider_confirmed_cost": null,
  "record_id": "2026-08-24-pr-linux-baseline",
  "repository": "MarcoPorcellato/matryca-plumber",
  "schema_version": "1.0",
  "source_sha": "48eae93b1152c9fe7d1f19d63de3f781b686932e",
  "source_urls": [
    "https://github.com/MarcoPorcellato/matryca-plumber/actions"
  ],
  "supersedes": null,
  "verifier": {
    "completed_at": null,
    "conclusion": "success",
    "elapsed_seconds": 50,
    "run_id": 32330532453,
    "started_at": null
  },
  "workflow_runs": [
    {
      "completed_at": null,
      "conclusion": "success",
      "elapsed_seconds": 314,
      "job_id": null,
      "job_name": "Ironclad Gatekeeper plus Python 3.13 evidence",
      "run_id": 32301476065,
      "source_sha": "5d2e6cdf74aaf40ea2d6cfed68b121ac32dd395b",
      "started_at": null
    }
  ]
}
