{
  "billing_source": null,
  "candidate_hosted_seconds": 319,
  "captured_at": "2026-08-24T12:00:00Z",
  "ccp": {
    "conclusion": "PASS",
    "configuration_digest": "sha256:c1c620a8f037d5368368eac8276c38e915b7663eafa4a1499b9e3a9b14166670",
    "local_elapsed_seconds": 420,
    "policy_digest": "sha256:aaaaaaaaaaaaaaaaaaaaaaaaaaaaaaaaaaaaaaaaaaaaaaaaaaaaaaaaaaaaaaaa",
    "receipt_digest": "sha256:bbbbbbbbbbbbbbbbbbbbbbbbbbbbbbbbbbbbbbbbbbbbbbbbbbbbbbbbbbbbbbbb",
    "runtime_ids": ["node22", "python312", "python313"],
    "source_sha": "1111111111111111111111111111111111111111"
  },
  "classification": "eligible",
  "comparability": "pass",
  "eligibility_reason": "Exact-head local receipt and remote verifier both passed during parallel hosted observation.",
  "estimated_avoided_hosted_seconds": 319,
  "estimated_net_hosted_seconds_saved": 269,
  "fallback_reason": null,
  "limitations": [
    "Fixture evidence is synthetic and cannot support a public savings claim."
  ],
  "negative_case": null,
  "observed_verifier_seconds": 50,
  "pr_number": 700,
  "provider_confirmed_billed_minutes": null,
  "provider_confirmed_cost": null,
  "record_id": "2026-08-24-pr-700-eligible",
  "repository": "MarcoPorcellato/matryca-plumber",
  "schema_version": "1.0",
  "source_sha": "1111111111111111111111111111111111111111",
  "source_urls": [
    "https://github.com/MarcoPorcellato/matryca-plumber/actions/runs/1"
  ],
  "supersedes": null,
  "verifier": {
    "completed_at": "2026-08-24T12:00:50Z",
    "conclusion": "success",
    "elapsed_seconds": 50,
    "run_id": 1,
    "started_at": "2026-08-24T12:00:00Z"
  },
  "workflow_runs": [
    {
      "completed_at": "2026-08-24T12:05:19Z",
      "conclusion": "success",
      "elapsed_seconds": 319,
      "job_id": 1,
      "job_name": "Candidate Linux cohort",
      "run_id": 1,
      "source_sha": "1111111111111111111111111111111111111111",
      "started_at": "2026-08-24T12:00:00Z"
    }
  ]
}
