{
  "billing_source": null,
  "candidate_hosted_seconds": 319,
  "captured_at": "2026-08-24T00:00:00Z",
  "ccp": null,
  "classification": "observed_baseline",
  "comparability": "pass",
  "eligibility_reason": "Historical pre-activation median for two candidate Linux jobs with one external verifier proxy.",
  "estimated_avoided_hosted_seconds": 319,
  "estimated_net_hosted_seconds_saved": 269,
  "fallback_reason": null,
  "limitations": [
    "The verifier sample belongs to the CCP repository rather than Matryca Plumber.",
    "Elapsed seconds are not provider billing, energy, or monetary evidence.",
    "Historical baseline records never enter the activated savings numerator."
  ],
  "negative_case": null,
  "observed_verifier_seconds": 50,
  "pr_number": null,
  "provider_confirmed_billed_minutes": null,
  "provider_confirmed_cost": null,
  "record_id": "2026-08-24-pr-linux-baseline",
  "repository": "MarcoPorcellato/matryca-plumber",
  "schema_version": "1.0",
  "source_sha": "48eae93b1152c9fe7d1f19d63de3f781b686932e",
  "source_urls": [
    "https://github.com/MarcoPorcellato/matryca-plumber/actions/runs/32301476065",
    "https://github.com/MarcoPorcellato/matryca-plumber/actions/runs/32299548837",
    "https://github.com/MarcoPorcellato/matryca-plumber/actions/runs/32298799053",
    "https://github.com/MarcoPorcellato/matryca-plumber/actions/runs/32298430532",
    "https://github.com/MarcoPorcellato/matryca-plumber/actions/runs/32297333571",
    "https://github.com/MarcoPorcellato/matryca-plumber/actions/runs/32213103036",
    "https://github.com/MarcoPorcellato/commit-ci-preflight/actions/runs/32330532453"
  ],
  "supersedes": null,
  "verifier": {
    "completed_at": null,
    "conclusion": "success",
    "elapsed_seconds": 50,
    "run_id": 32330532453,
    "started_at": null
  },
  "workflow_runs": [
    {"completed_at": null, "conclusion": "success", "elapsed_seconds": 314, "job_id": null, "job_name": "Ironclad Gatekeeper plus Python 3.13 evidence", "run_id": 32301476065, "source_sha": "5d2e6cdf74aaf40ea2d6cfed68b121ac32dd395b", "started_at": null},
    {"completed_at": null, "conclusion": "success", "elapsed_seconds": 314, "job_id": null, "job_name": "Ironclad Gatekeeper plus Python 3.13 evidence", "run_id": 32299548837, "source_sha": "2d1d289ff7f207f9b464b50405767d6524dec998", "started_at": null},
    {"completed_at": null, "conclusion": "success", "elapsed_seconds": 325, "job_id": null, "job_name": "Ironclad Gatekeeper plus Python 3.13 evidence", "run_id": 32298799053, "source_sha": "1030016e48e9de64b51c0fc6caf147f39b389377", "started_at": null},
    {"completed_at": null, "conclusion": "success", "elapsed_seconds": 322, "job_id": null, "job_name": "Ironclad Gatekeeper plus Python 3.13 evidence", "run_id": 32298430532, "source_sha": "7c376e21732a3b90329369eea2dae1531633b703", "started_at": null},
    {"completed_at": null, "conclusion": "success", "elapsed_seconds": 316, "job_id": null, "job_name": "Ironclad Gatekeeper plus Python 3.13 evidence", "run_id": 32297333571, "source_sha": "eab3c1c648f219e9d9653b01135ee1bbb0fd0551", "started_at": null},
    {"completed_at": null, "conclusion": "success", "elapsed_seconds": 339, "job_id": null, "job_name": "Ironclad Gatekeeper plus Python 3.13 evidence", "run_id": 32213103036, "source_sha": "f00d8c1a84a12455364e19ed0cd15526677ad9f9", "started_at": null}
  ]
}
